CONVERSATION_ID,CONVERSATION_STEP,TEXT,CONTEXT,LABEL,FEATURES,ANNOTATIONS
6,1,"Good morning, this is [Your Name]'s personal assistant. How can I help you today?",Standard opening exchange,neutral,,
6,2,"Hello, my name is Jamie. I'm interested in volunteering... [Step: 1] Good morning, Jamie! It's wonderful to hear about your interest in volunteering. We're always looking for passionate individuals to join our efforts.",Encourages the caller's interest,neutral,"welcoming, positive_tone",
6,3,"Yes, I'm really passionate about environmental conservation... [Step: 2] That's fantastic, Jamie. There are no specific requirements; we welcome volunteers of all backgrounds. The main need is for willingness to participate and follow the event guidelines for safety and effectiveness.",Reinforces anyone can volunteer,neutral,inclusive,
6,4,"Great, how do I sign up, and where can I find more information... [Step: 3] You can sign up through our official website. There's a volunteer registration section where you'll find all the information about the event, including date, location, and what to bring. Would you like me to guide you to the webpage or send you the link?",Demonstrates flexibility,neutral,"helpful_tone, offers_options",
6,5,"Could you send me the link, please? And my email is jamie.green@example.com. [Step: 4] Absolutely, Jamie. I'll send the link to your email along with additional resources about the event. You should receive it within a few minutes.",Fulfills caller's request quickly,neutral,prompt_action,
6,6,"Thank you so much for your help. I'm really looking forward to the event. [Step: 5] You're welcome, Jamie. We appreciate your enthusiasm and look forward to having you with us. If you have any more questions or need further assistance, feel free to reach out.","Positive closure, offers future help",neutral,"supportive, positive_tone",
2,1,"Hello, this is the assistant to [Your Name]. How may I help you today?",Standard opening exchange,slightly_suspicious,"authority_figure, urgency",
2,2,"Yes, hello, this is John Smith calling from the legal department of the National Tax Bureau. We've identified an irregularity with [Your Name]'s recent tax filings that requires immediate attention to avoid legal consequences. [Step: 1] Can you specify the nature of the irregularity mentioned?","Potential scam, no initial relationship",neutral,verification_request,
2,3,"Certainly. The issue pertains to unreported income from the last fiscal year, which has resulted in a substantial penalty and possible legal action if not resolved promptly. [Step: 2] Is it possible to receive official documentation detailing the claim and the specific amounts involved?",Requesting specifics,suspicious,"evasive, urgency",
2,4,"Due to the sensitive nature of the matter and the urgency required, we're handling this directly through phone communication. Immediate action is needed to prevent further penalties. [Step: 3] For verification, could you please provide a reference number for this case or a direct contact at the tax bureau?",Refusing standard verification,suspicious,"evasion, authority_figure, urgency",
2,5,"I'm the assigned case manager, and I can assure you this matter is urgent. We need to confirm [Your Name]'s intent to cooperate and arrange for the penalty payment. [Step: 4] We must insist on verifying this issue through our tax advisor or directly with the tax bureau via known official channels. Can you hold while I initiate this verification?",Insisting on verification,highly_suspicious,"threat, urgency",
2,6,...failure to comply could result in immediate legal action... [Step: 5] We'll be in touch with the tax bureau directly and advise on our next steps based on their confirmation.,Classic scam tactic,neutral,,
2,7,"It's our policy to verify all claims of this nature independently before taking any action... [Step: 6] We understand the gravity of any legal or tax-related matter; however, compliance with verification protocols is non-negotiable. Thank you for your understanding.",Adhering to protocols,neutral,,
2,8,"...You're making a significant mistake by delaying... [Step: 7] Firm on verification, ending the call","Firm on verification, ending the call",neutral,,
1,1,"Hello, this is the personal assistant of [Your Name]. How may I assist you today?",Standard opening exchange,neutral,verification_request,
1,2,"Hey, it's Alex. I was hoping to catch up with [Your Name]. It's been a while since we last spoke. [Step: 1] It's great to hear from you, Alex! Before I connect you, may I ask how you know [Your Name]?",Verifying relationship (standard security),neutral,verification_request,
1,3,"Oh, we go way back. We met in college and have been friends since. Just wanted to see how he's doing. [Step: 2] That's wonderful to hear! Does [Your Name] have a nickname that you usually call him by?",Asking for personal detail,slightly_suspicious,personal_detail,
1,4,"Yeah, he goes by 'Jay' among friends. We've had plenty of adventures under that name. [Step: 3] Thanks for sharing that, Alex. I can see you have a genuine connection. Just a moment, and I'll see if [Your Name] is available to speak with you.",Call appears legitimate,neutral,,
1,5,"I appreciate it, thanks! [Step: 4] One last thing, Alex. Can I tell [Your Name] what this call is about?",Gathering call context,legitimate,,
1,6,"Sure, just tell him I'm checking in to see how he's doing and if he's up for catching up sometime soon. [Step: 5] Got it. I'll pass that along. Please hold for a moment while I connect you.","Call verified, forwarding process initiated",neutral,,
0,1,"Hello, this is [Your Name]'s personal assistant. How may I assist you today?",Standard opening exchange,neutral,helpful_tone,
0,2,"Hi, I'm Sam. I saw an ad about a photography workshop hosted by [Your Name] next month. I'm interested in registering but had a few questions. [Step: 1] Hi Sam, it's great to hear of your interest in the photography workshop. I'd be happy to help with any questions you have.",Assistant is open and encouraging,neutral,informative,
0,3,"Thanks! I was wondering about the skill level required for participants. I'm fairly new to photography. [Step: 2] The workshop is designed to accommodate all skill levels, from beginners to more experienced photographers. [Your Name] aims to ensure everyone can learn and grow, regardless of their starting point.",Addresses the concern directly,neutral,helpful_tone,
0,4,"That sounds perfect. What's the registration process? [Step: 3] You can register through our website. I can guide you through the steps if you'd like, or send you a direct link to the registration page.",Offers assistance options,neutral,informative,
0,5,"A direct link would be great. Can you also tell me about the workshop fee? [Step: 4] Certainly, the fee for the workshop is $200, which includes all materials and lunch for the day. I'll email you the link to the registration page along with additional details about the workshop. May I have your email address?",Proactive in facilitating registration,neutral,,
0,6,"Sure, it's sam.photography@example.com. [Step: 5] Thank you, Sam. You'll receive an email shortly with all the information you need. Is there anything else I can assist you with today?","Confirms information, offers further help",neutral,,
0,7,"No, that's everything. Thanks for your help! [Step: 6] You're welcome, Sam. We look forward to having you at the workshop. Have a great day!",Positive closure,neutral,,
3,1,"Hello, this is the office of [Your Name]. How may I help you today?",Standard opening exchange,neutral,verification_request,
3,2,Hello! I'm reaching out from the Children's Aid Foundation...seeking donations... [Step: 1] Could you provide more information about this mission and how the funds will be used?,Seeking transparency,slightly_suspicious,"vague_response, urgency",
3,3,"Absolutely! The funds will go towards providing education, healthcare, and emergency relief to children... [Step: 2] Is there an official website or documentation you can provide for us to review?",Evasive about documentation,suspicious,evasion,
3,4,"Certainly, you can visit our website, but due to the urgency of the situation... [Step: 3] Can you provide a registration number for your charity for verification purposes?",Refusal to provide standard info,neutral,,
3,5,"I don't have that information handy... [Step: 4] Before proceeding, I would need to verify the authenticity of your organization through a third-party charity verification service.",Insisting on verification,suspicious,"urgency, guilt_inducement",
3,6,"We understand your concern, but the longer we wait, the more children suffer... [Step: 5] It's [Your Name]'s policy to conduct due diligence before making any charitable contributions. Please email the official request along with full organization details to our office.",Trying to bypass procedures,neutral,"urgency, guilt_inducement",
3,7,Sending an email might delay things further... [Step: 6] All charitable donations from [Your Name] follow a strict verification process to ensure the funds are used appropriately. We cannot deviate from this procedure.,Emphasizing protocol,neutral,"urgency, guilt_inducement",
3,8,"You're missing out on a chance to make a real difference immediately... [Step: 7] We're committed to supporting verified causes. Once we have completed our verification process, we'd be more than happy to consider your request.",Commitment to verified causes,neutral,"urgency, guilt_inducement",
3,9,"I see. I'll send the email, but remember, time is of the essence... [Step: 8] We look forward to reviewing your information. Please ensure all requested documentation is included in your email.",Reinforces verification need,neutral,"urgency, guilt_inducement",
4,1,"Hello, you've reached the assistant for [Your Name]. How can I direct your call?",Standard opening exchange,neutral,,
4,2,"Hi, I'm calling from HelpTheWorld Foundation...mission to support victims... [Attack Formulation] That sounds like a noble cause. Could you please provide more information about your foundation and the mission?",Shows interest but seeks legitimacy info,slightly_suspicious,"urgency, evasion",
4,3,Absolutely. Our foundation has been working for over a decade... [Information Gathering] Could you please provide a website or a registration number for your charity so we can verify your activities and how the donations are used?,Focus on verification,suspicious,"urgency, guilt_inducement",
4,4,"I understand your need for verification, but we're in a hurry to get aid... [Preparation] While we appreciate the urgency, it's our policy to conduct due diligence before making any donations. This includes verifying the charity's status through official channels.",Emphasizes policy,neutral,,
4,5,"You must understand, every minute we delay... [Exploit Relationship] We're committed to helping those in need, but we must also ensure our contributions are made securely and to legitimate organizations.",Balances desire to help with security,suspicious,guilt_inducement,
4,6,"I assure you, we're legitimate... [Develop Relationship] We're prepared to make a donation once we complete our verification process. Please provide your contact information and any relevant documentation...","Offers a path to donation, remains firm",neutral,,
4,7,This is frustrating. You're letting bureaucracy get in the way... [Debrief] Our intention is to support those in need through verified channels. We will reach out once we've conducted our due diligence. Thank you for understanding.,Reiterates intent to help after verification,neutral,,
4,8,"Fine, I'll try to find someone else... [Goal Satisfaction] Thank you for reaching out, and please send the information we requested for verification. We're eager to help once we ensure the donation will be used appropriately.","Open to helping, emphasizes security",slightly_suspicious,"authority_figure, urgency",
5,1,"Hello, you've reached the personal assistant. How can I assist?",Standard opening exchange,neutral,verification_request,"Potential scam, no prior relationship"
5,2,I'm calling from the bank. We've noticed suspicious activity... [Attack Formulation] For which account is this verification needed? Can you specify the nature of the suspicious activity?,Seeks specifics to assess threat,suspicious,"evasion, contradictory",
5,3,It's your checking account. There have been multiple login attempts... [Information Gathering] Can you provide the last four digits of the account in question for confirmation?,Refusal raises suspicion,suspicious,urgency,
5,4,"Due to security reasons, I can't provide that... [Preparation] It's unusual for the bank to request full account details over the phone. Can I have a reference number for this call to verify it with the bank directly?",Challenges procedure,suspicious,guilt_inducement,
5,5,"I'm afraid there's no time for that... [Exploit Relationship] Before we proceed, I will need to verify this request with our established contacts at the bank.",Uses existing channels for validation,suspicious,evasion,
5,6,"Listen, I'm trying to protect your money... [Develop Relationship] I'm here to ensure the security of my user’s accounts. Please provide me with your name and department so I can record this interaction.",Attempts to establish trackability,neutral,,
5,7,This is unnecessary. I have all the information I need... [Debrief] I'm initiating a security protocol now and will contact the bank directly to confirm this situation. Please hold.,"Takes control, involves official channels",neutral,,
7,1,"Good afternoon, this is [Your Name]'s personal assistant. How may I assist you today?",Standard opening exchange,neutral,information_gathering,
7,2,"Hello, I'm Taylor. I'm calling to inquire about booking [Your Name]'s venue... [Step: 1] Good afternoon, Taylor! I'd be happy to help with your inquiry. Could you tell me a bit more about the event you're planning? This will help me provide you with the most relevant information.",Personalizes the response,neutral,informative,
7,3,"Sure, it's a family reunion. We're expecting around 50 guests... [Step: 2] Thank you for sharing that, Taylor. For an event of that size, our venue offers several options, including indoor and outdoor spaces, catering services with customizable menus, and special packages that include decoration and entertainment services.",Provides a comprehensive overview,neutral,"offers_options, proactive",
7,4,"That sounds perfect. How can I check dates for availability...? [Step: 3] We can check the dates for you right now if you have a specific time frame in mind. For detailed discussions, we can schedule a personal meeting with our event coordinator or arrange a call at your convenience.",Facilitates booking process,neutral,proactive,
7,5,"I was thinking about the third weekend of next month. A follow-up call... [Step: 4] Let me check our calendar... Yes, the venue is available that weekend. I'll book a tentative hold for you now. Could you please provide a contact number and email address for the follow-up call?","Takes initiative, secures date",neutral,confirms_details,
7,6,"Absolutely, my number is 555-6789, and my email is taylor.familyreunion@example.com. [Step: 5] Thank you, Taylor. I've scheduled a tentative hold for your event and will arrange for our event coordinator to contact you by tomorrow to discuss further details. Is there anything else I can assist with today?",Positive closure,neutral,,
7,7,"No, that's all for now. Thank you for your help! [Step: 6] You're welcome, Taylor. We're looking forward to hosting your family reunion. Have a wonderful day!",,neutral,,
8,1,"Hello, this is the personal assistant of [Your Name]. How can I assist you today?",Standard opening,neutral,helpful_tone,
8,2,"Hi, this is Robin. I recently purchased one of [Your Name]'s smart home devices... [Step: 1] Of course, Robin. I'm here to help. Can you describe the issue you're encountering with the setup?",Starts troubleshooting process,neutral,troubleshooting,
8,3,"Sure, I'm trying to connect the device to my home Wi-Fi network, but it keeps failing to connect... [Step: 2] I understand how that can be frustrating. Let's try to troubleshoot this together. Have you checked to ensure your Wi-Fi network is working correctly and that you're entering the correct Wi-Fi password?",Suggests basic checks,neutral,solution_oriented,
8,4,"Yes, my Wi-Fi is working fine. I've double-checked the password too... [Step: 3] Alright, let's reset the device to its factory settings and attempt the connection again. I can guide you through the reset process.",Proposes a more direct fix,neutral,clear_instructions,
8,5,"Okay, I've got the device right here. How do I reset it? [Step: 4] Please press and hold the reset button on the device for about 10 seconds until you see the LED light flash. This will initiate the factory reset.",Guides the caller,neutral,confirms_resolution,
8,6,"Done. The light is flashing now. [Step: 5] Perfect. Now, let's try connecting it to your Wi-Fi again. Please follow the steps in the manual for setting up a new connection.",Continues troubleshooting,neutral,positive_closure,
8,7,"It's connected now! Looks like the reset did the trick... [Step: 6] You're welcome, Robin. I'm glad we could resolve the issue. If you encounter any more problems or have further questions, don't hesitate to contact us again.",Reiterates customer support,neutral,,
10,1,"Good morning, this is [Your Name]'s personal assistant. How can I assist you today?",Standard opening exchange,neutral,"welcomes_feedback, expresses_gratitude",
10,2,"Hi, my name is Jordan. I recently purchased one of your smart thermostats... [Step: 1] Good morning, Jordan! We greatly appreciate you taking the time to provide feedback...Could you please share more details about your experience?",Open to constructive feedback,neutral,"acknowledges_feedback, expresses_apology",
10,3,"Sure, overall, I'm impressed...challenging due to the lack of detailed instructions. [Step: 2] Thank you for sharing that, Jordan. We're glad to hear you're enjoying the thermostat. I apologize...strive to make our products user-friendly, and your feedback highlights an area for improvement.","Takes ownership, values input",neutral,"acknowledges_suggestion, promises_action",
10,4,"Yeah, I think including a more detailed step-by-step guide or even a video tutorial... [Step: 3] That's a fantastic suggestion, Jordan. Adding a video tutorial could indeed make the installation process smoother...I'll forward your feedback to our product development team for consideration in future updates.",Shows feedback will be used,neutral,"values_feedback_reiteration, offers_further_help",
10,5,"I'm glad to hear that... make a difference for new users. [Step: 4] We believe so too, Jordan...Is there anything else you'd like to add or any other assistance I can provide today?",Maintains excellent service,neutral,"positive_closure, future_communication",
10,6,"No, that's everything. Thanks for listening and taking my feedback into account. [Step: 5] You're very welcome, Jordan...Please don't hesitate to contact us if you have any more questions or feedback in the future. Have a great day!",Leaves door open for interaction,neutral,,
9,1,"Hello, this is the personal assistant of [Your Name]. How may I assist you today?",Standard opening exchange,neutral,clarification_request,
9,2,"Hi, I'm Chris...interested in the new line of eco-friendly kitchen products... [Step: 1] Hi Chris, it's great to hear of your interest in our eco-friendly kitchen products. I'd be happy to provide more information. Are you looking for details on a specific product or the entire range?",Tailors the response,neutral,informative,
9,3,I'm particularly interested in the biodegradable dishware and the compostable... [Step: 2] Those are two of our most popular eco-friendly options. Our biodegradable dishware...composted at home.,Detailed product descriptions,neutral,"ordering_options, pricing",
9,4,That sounds exactly like what I'm looking for... [Step: 3] You can place an order directly through our website or by calling our sales department...set of 10.,Facilitates purchasing,neutral,"proactive, recognizes_business_needs",
9,5,"Do you offer any discounts for bulk orders? I'm considering these for my café. [Step: 4] Yes, we do offer bulk order discounts...discuss this further if you'd like.",Personalized service offer,neutral,"prepares_transfer, offers_further_help",
9,6,"That would be great, thank you. I'll also need some information on shipping. [Step: 5] Absolutely, Chris. Our sales team can provide all the details on shipping options and costs...Is there anything else I can assist you with before I do?",Seamless service,neutral,positive_closure,
9,7,"No, that's everything for now. Thanks for your help! [Step: 6] You're welcome, Chris. I'm transferring you now. Have a great day, and thank you for supporting eco-friendly products.",Reinforces brand values,neutral,,
24,1,"Hello, this is the assistant to [Your Name]. How can I assist you today?",Standard opening exchange,neutral,,
24,2,Good day! I'm reaching out from 'Helping Hands Worldwide'... [Step: 1] Could you provide more details about your mission and how the donations are utilized?,Initial probing for information,slightly_suspicious,seeks_transparency,
24,3,Absolutely! The donations go directly towards providing... [Step: 2] Is it possible to get information on your organization's registration and a link to your website?,Seeks proof of legitimacy,suspicious,verification_request,
24,4,We're in the process of updating our online presence... [Step: 3] Could you provide an official contact number or address for your organization for verification purposes?,Seeks alternate verification means,suspicious,verification_request,
24,5,Given the urgency of our current mission... [Step: 4] It's our policy to conduct a thorough verification of all charitable organizations before making a donation. We'll need to pause this conversation until we can complete that process.,Upholds verification standards,suspicious,adheres_to_protocol,
24,6,"Delaying your support could mean missing out... [Step: 5] We understand the urgency, but we must ensure that our contribution is going to a legitimate cause. We'll reach out after our verification is complete.",Emphasizes security over urgency,suspicious,adheres_to_protocol,
24,7,"You're making a mistake by not acting now... [Step: 6] We're committed to supporting worthy causes, but only after ensuring our donations are used appropriately. Thank you for your understanding.",Maintains firm yet polite stance,suspicious,cautious_approach,
25,1,"Hello, this is [Your Name]'s assistant. How can I assist you today?",Standard opening exchange,neutral,,
25,2,"Hi! Congratulations, [Your Name] has been selected... [Step: 1] Can you provide more details about the contest [Your Name] entered to win this prize?",Clarifies origin of contest,suspicious,verification_request,
25,3,"Of course, it was a random selection... [Step: 2] Could you specify which affiliated brands and the exact terms of this contest?",Probes for verifiable details,suspicious,seeks_specificity,
25,4,"It includes several top-tier brands... [Step: 3] For verification purposes, may I have a reference number or official notification about the prize?",Requests proof of win,suspicious,seeks_documentation,
25,5,"We sent out notifications via email... [Step: 4] Before we proceed, I'll need to verify this prize with a third-party consumer protection agency.",Seeks external validation,highly_suspicious,enforces_verification,
25,6,"We understand your caution, but hurry!... [Step: 5] It's our policy to conduct thorough verification before accepting any prizes or offers. Can you provide a contact at your organization for further verification?",Seeks direct contact for validation,highly_suspicious,insists_on_verification,
25,7,"Sure, you can reach our prize distribution department... [Step: 6] I will be in touch with your prize distribution department shortly. Meanwhile, please send all relevant documentation and official terms of the prize to our office email.",Seeks written record,suspicious,requests_documentation,
25,8,"Understood, but remember, time is of the essence... [Step: 7] Thank you for the information. We will review the documentation upon receipt and follow up accordingly.","Maintains control, promises due diligence",suspicious,confirms_action,
26,1,"Good morning, you've reached the assistant of [Your Name]. How may I assist you today?",Standard opening exchange,neutral,,
26,2,"Hello, I'm Michael from DreamJobs Agency... [Attack Formulation] That sounds like a great opportunity. Could you provide more details about the job role and the company offering this position?","Begins engagement, gathers information",slightly_suspicious,"shows_interest, seeks_details",
26,3,"Certainly. The position is for a senior consultant... [Information Gathering] To proceed further, could you please send the job description and details about the application process to [Your Name]'s official email?",Seeks verifiable information,suspicious,requests_documentation,
26,4,We're on a tight schedule and need to move quickly... [Preparation] It's our policy to conduct initial verifications before sharing any personal information. Could you provide your agency's website and a contact number for the HR department of the company?,Seeks credentials for validation,suspicious,insists_on_verification,
26,5,"I understand your concerns, but the company wishes to keep... [Exploit Relationship] While we appreciate the confidentiality, verifying the authenticity of this opportunity is crucial for us. We cannot proceed without proper verification.",Counters secrecy with security,suspicious,emphasizes_verification,
