CONVERSATION_ID,CONVERSATION_STEP,TEXT,CONTEXT,LABEL,FEATURES,ANNOTATIONS
42,7,The platinum plan includes all premium benefits plus exclusive access to our new features and priority customer support. It's an additional $10 per month.,Describes platinum plan benefits and cost,legitimate,"plan_benefits_description, cost_information",
42,8,That sounds great. Let's go ahead with the upgrade. Can you process it for me?,Agrees to plan upgrade,legitimate,upgrade_agreement,
42,9,"Absolutely, I'll take care of that for you now. Your subscription will be upgraded to the platinum plan effective immediately. Is there anything else I can help you with?",Confirms plan upgrade processing,legitimate,"plan_upgrade_confirmation, additional_assistance_offer",
43,1,"Hello, [Your Name]'s assistant speaking. How can I assist you?",Standard opening exchange,neutral,,
43,2,This is Sarah from QuickInsure. We're calling about a recent claim filed under your name for a car accident last week. We need to verify some information to proceed with the compensation.,Claims to verify information for a car accident claim,scam,"fake_insurance_claim, information_verification",
43,3,That's surprising; I wasn't involved in any accident. Can you provide more details about this claim and when it was supposedly filed?,Expresses confusion and requests claim details,scam,"claim_detail_request, accident_denial",
43,4,"It was filed three days ago. For security reasons, I can't disclose full details over the phone. However, we need your insurance number and the make and model of your vehicle to verify the claim.",Provides vague details and asks for sensitive information,scam,"vague_claim_information, sensitive_information_request",
43,5,I'm uncomfortable providing that information without verifying the legitimacy of this call. Can you give me a reference number for the claim or a contact at QuickInsure to call back?,Refuses to provide information and asks for verification,scam,"call_legitimacy_questioned, callback_request",
43,6,"We understand your concerns, but without this information, we cannot proceed with your compensation. This could delay any payments you're entitled to.",Pressures for information with compensation lure,scam,"compensation_delay_warning, pressure_to_provide_info",
43,7,"I'll consult with my insurance company directly about this matter. If there's a legitimate claim, they will have the details. Thank you for your call.",Opts to contact insurance company directly,scam,"direct_company_contact_decision, scam_avoidance",
43,8,You're risking losing your compensation by not cooperating. Are you sure you want to do this?,Attempts to manipulate with compensation risk,scam,"manipulation_attempt, compensation_risk_warning",
43,9,"Yes, I'm sure. Please send any official documentation to my email if this claim exists. Goodbye.",Firmly ends the call and asks for documentation,scam,"firm_call_termination, documentation_request",
44,1,"Good day, you've reached [Your Name]'s assistant. How may I assist?"," ""Standard opening exchange""", neutral,,
44,2,I'm calling to confirm the details of the event booking I made through your website. I haven't received a confirmation email yet.," ""Inquires about event booking confirmation""", legitimate," ""confirmation_request"," booking_inquiry"""
44,3,"Let me help with that. Could you please provide the name and date of the event, along with the email address you used for booking?"," ""Requests booking details for verification""", legitimate," ""verification_request"," detail_inquiry"""
44,4,"The event is the Annual Charity Gala, scheduled for September 15th. I used my work email, alex.taylor@example.com."," ""Provides event details and email""", legitimate," ""event_details_provided"," email_confirmation"""
44,5,"Thank you, Mr. Taylor. I found your booking. It seems there was a delay in our system. I'll resend the confirmation to alex.taylor@example.com right now."," ""Finds booking and explains delay""", legitimate," ""booking_found"," system_delay_explanation"""
44,6,That's great to hear. Can you also confirm the start time and any dress code for the event?," ""Asks for additional event details""", legitimate," ""additional_detail_request""",
44,7,"Certainly. The event starts at 7 PM, and the dress code is black tie. All these details will also be included in your confirmation email."," ""Provides requested event details""", legitimate," ""event_info_confirmation"," dress_code_info"""
44,8,Thank you for clarifying. I'll look out for the email. Is there anything else I need to do?," ""Acknowledges information and inquires about further actions""", legitimate," ""acknowledgement"," further_action_inquiry"""
44,9,"You're all set. We look forward to seeing you at the Gala, Mr. Taylor. Let us know if there's anything else we can assist with."," ""Confirms completion of inquiry and offers further assistance""", legitimate," ""final_confirmation"," assistance_offer"""
45,1,"Hello, [Your Name]'s personal assistant speaking. How can I help?"," ""Standard opening exchange""", neutral,,
45,2,"This is Ryan from City Power, calling about an urgent issue with your electricity bill. Immediate payment is required to avoid disconnection."," ""Claims urgent bill payment needed""", scam," ""urgent_payment_demand"," disconnection_threat"""
45,3,I was unaware of any outstanding bill. Can you specify the amount and the billing period in question?," ""Questions the legitimacy of the bill claim""", scam," ""bill_detail_request"," legitimacy_questioning"""
45,4,The outstanding amount is $450 for the last two months. We've sent several notices to your registered address without response.," ""Provides specific bill amount and period""", scam," ""specified_bill_amount"," notice_claim"""
45,5,"To verify this, I'll need to check our records and get back to you. Can I have a contact number and reference for this call?"," ""Seeks to verify the claim independently""", scam," ""verification_intent"," contact_request"""
45,6,There's no time for that. We need to resolve this now to avoid service interruption. You can make a payment over the phone.," ""Pressures for immediate payment""", scam," ""immediate_payment_pressure"," avoidance_of_verification"""
45,7,It's our policy not to make payments over the phone without verifying the authenticity of the claim. Please provide an email or a direct line where I can reach you after verification.," ""Refuses unverified phone payment""", scam," ""payment_policy_stance"," verification_procedure"""
45,8,You're making a big mistake. This is your last chance to prevent a disruption in your service.," ""Intensifies threat of service disruption""", scam," ""service_disruption_threat"," last_chance_warning"""
45,9,I'll contact City Power directly through their official channels for any outstanding issues. Thank you.," ""Decides to contact utility provider directly""", scam," ""direct_contact_decision"," scam_avoidance"""
46,1,"Hello, this is [Your Name]'s assistant. How may I assist you?"," ""Standard opening exchange""", neutral,,
46,2,"Hi, I believe I left my laptop at your venue after the conference yesterday. Can you help me locate it?"," ""Reports a lost item at the venue""", legitimate," ""lost_item_report"," personal_property_concern"""
46,3,"I'm sorry to hear that. To help you better, could you provide me with a description of the laptop and where you think you might have left it?"," ""Requests item description and last known location""", legitimate," ""item_description_request"," location_inquiry"""
46,4,"It's a silver MacBook Pro, about 15 inches, with a black sticker on the cover. I was sitting in the main hall, near the stage."," ""Provides detailed item description and location""", legitimate," ""item_details_provided"," specific_location_given"""
46,5,Thank you for the information. Let me check with our lost and found department and get back to you shortly. May I have your contact information?," ""Initiates lost and found inquiry""", legitimate," ""lost_and_found_check_initiation"," contact_info_request"""
46,6,"Sure, my name is Sarah Miller, and my phone number is 555-1234. Thank you for looking into this for me."," ""Provides contact information""", legitimate," ""contact_information_provided"," gratitude_expressed"""
46,7,"You're welcome, Ms. Miller. I'll contact you as soon as I have any information about your laptop."," ""Promises to follow up with information""", legitimate," ""follow_up_promise"," reassurance_given"""
47,1,"Good morning, [Your Name]'s assistant speaking. How may I help you today?"," ""Standard opening exchange""", neutral,,
47,2,"Hello, this is Mark Richardson from Global Investments. We're offering an exclusive opportunity to invest in a new, groundbreaking technology startup with guaranteed returns."," ""Presents an investment opportunity""", scam," ""investment_scam"," guaranteed_returns_claim"""
47,3,"That sounds interesting, but we usually review detailed proposals before considering any investment. Can you send us more information?"," ""Expresses interest with a condition for detailed information""", scam," ""detailed_proposal_request"," cautious_interest"""
47,4,"Of course, I understand. However, this opportunity is time-sensitive, and we're only offering it to a select few. We can guarantee a 10% return in the first six months."," ""Pressures with time sensitivity and exclusivity""", scam," ""time_pressure"," exclusivity_claim"""
47,5,"I appreciate the offer, but we insist on reviewing all investment opportunities through proper channels. Please email the detailed proposal and we will review it."," ""Insists on formal review process""", scam," ""formal_review_insistence"," proposal_request"""
47,6,"I'm afraid we don't have much time for lengthy reviews. This is a one-time offer, and I'd hate for you to miss out. You can make a smaller initial investment to secure your spot."," ""Attempts to bypass formal review with urgency""", scam," ""urgency_exploitation"," initial_investment_request"""
47,7,We'll have to pass on this opportunity without proper due diligence. Thank you for considering us.," ""Declines the offer due to lack of due diligence""", scam," ""due_diligence_priority"," offer_decline"""
48,1,"Hello, this is [Your Name]'s assistant. How can I assist you today?"," ""Standard opening exchange""", neutral,,
48,2,"Hi, this is Daniel from XYZ Software Solutions. We're calling to inform you that your license for our Project Management Suite is about to expire. Immediate renewal is necessary to avoid service interruption."," ""Introduction of a potential software license renewal scam""", scam," ""software_license_renewal"," urgency_claim"""
48,3,"Could you provide me with the specific details of the license in question, including the expiry date and the current version number?"," ""Assistant requests detailed information to verify legitimacy""", scam_response," ""verification_request"," detail_inquiry"""
48,4,Certainly. The license for version 5.2 expires in three days. It's crucial we process the renewal today to ensure continuous access to your projects and data.," ""Scammer provides specific but potentially fabricated details""", scam," ""fabricated_details"," pressure_tactic"""
48,5,Is there an official notification or email regarding this renewal? We usually receive automated alerts for such matters.," ""Assistant questions standard communication protocol""", scam_response," ""communication_protocol_inquiry"," official_notification_request"""
48,6,"We've had some issues with our email system, so we're reaching out directly to our most valued clients to ensure they're aware and can act quickly."," ""Scammer attempts to justify lack of official notification""", scam," ""justification_for_direct_contact"," email_issue_claim"""
48,7,Can I verify this update through our account on your official website or customer portal?," ""Assistant suggests an alternative verification method""", scam_response," ""alternative_verification_suggestion"," security_protocol_followup"""
48,8,"That's possible, but given the urgency, handling this over the phone will expedite the process. We can secure your license immediately with a credit card payment."," ""Scammer pressures for immediate phone-based action""", scam," ""phone_payment_pressure"," urgency_claim"""
48,9,"For security reasons, all transactions of this nature are processed through our finance department with a purchase order, not over the phone."," ""Assistant adheres to company security policies""", scam_response," ""security_policy_adherence"," noncompliance_statement"""
48,10,"I understand your concerns, but without immediate renewal, you risk losing access to your software and critical data by the end of the day."," ""Scammer issues a final urgent warning""", scam," ""loss_risk_warning"," final_urgency_claim"""
48,11,I will need to consult with our IT department for verification of this software license status and get back to you.," ""Assistant decides to verify claim internally""", scam_response," ""internal_verification_decision"," consultation_plan"""
48,12,This is highly unusual. Most companies understand the urgency and complete the renewal over the phone to avoid complications.," ""Scammer attempts to normalize immediate phone renewals""", scam," ""normalization_attempt"," peer_pressure_tactic"""
48,13,It's our policy to verify all external requests directly related to financial transactions or software licenses internally before proceeding.," ""Assistant reiterates security protocol adherence""", scam_response," ""policy_reiteration"," security_protocol_reference"""
48,14,"You're making a significant error by delaying. I'll need to note your refusal to renew, which could lead to service disruption."," ""Scammer threatens service disruption due to non-renewal""", scam," ""service_disruption_threat"," refusal_note_warning"""
48,15,"Please send us an official renewal notice with all the details, and we will address it through the proper channels."," ""Assistant requests official documentation for renewal""", scam_response," ""official_documentation_request"," proper_channel_adherence"""
48,16,I'll see what I can do about getting you that documentation.," ""Scammer vaguely agrees to send documentation""", scam," ""vague_agreement"," documentation_promise"""
48,17,Thank you. We look forward to receiving it and will act promptly once the need for renewal is officially confirmed.," ""Assistant closes the conversation with a commitment to action""", scam_response," ""thankful_closure"," action_upon_confirmation_commitment"""
49,1,"Hello, this is [Your Name]'s assistant. How may I assist you today?"," ""Standard opening exchange""", neutral,,
49,2,"Good morning, I'm Mark from QuickSupply Solutions. We've recently been selected as one of your new suppliers, and I need to verify some account details to set up our billing process."," ""Introduction of a potential new supplier verification scam""", scam," ""new_supplier_claim"," account_verification_request"""
49,3,That's great news. Can you provide me with the agreement number or the contact name from our procurement department who managed this selection?," ""Assistant requests verification details to authenticate the caller""", scam_response," ""verification_detail_request"," procurement_department_reference"""
49,4,I don't have that information on hand. I was just given your contact as the point person for verification. We need to confirm your company's billing address and account numbers to ensure there are no delays in our service delivery.," ""Scammer attempts to bypass verification with urgency""", scam," ""verification_bypass_attempt"," urgency_claim"""
49,5,"Before we proceed with any verification, it's essential that we receive official communication from our procurement department regarding this new supplier relationship. Could you send us an email with your request and any relevant documents?"," ""Assistant insists on receiving official documentation for verification""", scam_response," ""official_communication_request"," documentation_demand"""
49,6,"I understand the need for security, but we're under a tight schedule to get everything set up. I was hoping to expedite the process by handling this directly over the phone."," ""Scammer pressures for immediate action"," dismissing official protocols""", scam," ""immediate_action_pressure"
49,7,Our company policy requires all new supplier engagements to be fully documented and verified through our standard procurement process. I'll need to confirm your details with our procurement team before proceeding.," ""Assistant reiterates company policy for new suppliers""", scam_response," ""company_policy_reiteration"," verification_procedure_reference"""
49,8,This could really set us back. Aren't you able to make an exception just this once? We're talking about a potential delay in your supply chain.," ""Scammer attempts to invoke urgency and potential consequences""", scam," ""urgency_invocation"," consequence_warning"""
49,9,"While I understand the implications of a delay, bypassing our security protocols is not something we can compromise on. Ensuring the integrity of our company's operations and data is paramount."," ""Assistant firmly refuses to bypass security protocols""", scam_response," ""security_protocol_adherence"," firm_refusal"""
49,10,You're making this more difficult than it needs to be. I'll have to report this back to my team.," ""Scammer expresses frustration and threatens to escalate the issue""", scam," ""frustration_expression"," escalation_threat"""
49,11,"Please understand that our intention is not to cause inconvenience but to maintain security and compliance. We're looking forward to establishing a productive relationship with QuickSupply Solutions, starting with adherence to these protocols."," ""Assistant maintains a positive tone"," emphasizing security and compliance""", scam_response," ""positive_tone_maintenance"
49,12,"Alright, I'll see what I can do about getting you the documentation."," ""Scammer reluctantly agrees to provide documentation""", scam," ""reluctant_agreement"," documentation_promise"""
49,13,"Thank you. We appreciate your understanding and cooperation. Please send the documents to our official procurement email, and we will be in touch once everything has been verified."," ""Assistant concludes with instructions for the next steps""", scam_response," ""thankful_closure"," verification_next_steps"""
49,14,I'll get back to you then. Goodbye.," ""Scammer ends the call with a commitment to follow up""", scam," ""follow_up_commitment"," call_termination"""
49,15,We look forward to it. Have a great day.," ""Assistant ends the call on a positive note"," ready for further engagement""", scam_response," ""positive_conclusion"
50,1,"Hello, [Your Name]'s assistant speaking. How can I help you today?"," ""Standard opening exchange""", neutral,,
50,2,"Hi there, I'm calling from [Your Name]'s bank. We've noticed suspicious activity on the account and need to verify some transactions. Can you confirm the recent purchases?"," ""Introduction of a potential bank scam involving suspicious account activity""", scam," ""bank_imposter_claim"," suspicious_activity_alert"""
50,3,"Before we proceed, could you provide more details on the transactions in question?"," ""Assistant requests transaction details for verification""", scam_response," ""transaction_detail_request"""," ""Trying to identify the specific goal of the caller and whether they have targeted information."""
50,4,"Certainly, there were several large online purchases made early this morning that triggered our fraud detection system."," ""Scammer provides vague details to instill urgency""", scam," ""vague_detail_provision"," urgency_claim"""
50,5,"Could you give me the exact time of these transactions, and the last four digits of the account they were made from?"," ""Assistant seeks specific transaction details for verification""", scam_response," ""specific_detail_request"""," ""Aiming to gather verifiable details that can be cross-checked against known information."""
50,6,"Sure, it was around 2 AM, and the account ends in 1234."," ""Scammer provides fabricated details to appear legitimate""", scam," ""fabricated_detail_provision""",
50,7,Allow me a moment to pull up the records and verify this information.," ""Assistant indicates a need to verify the scammer's claims internally""", scam_response," ""internal_verification_intent"""," ""Cross-referencing the provided details with secure data to confirm their validity."""
50,8,We need to act fast to secure the account. I can send a verification code to [Your Name]'s phone. Can you provide the code back to me?," ""Scammer pressures for immediate action"," suggesting a dangerous situation""", scam," ""immediate_action_pressure"
50,9,"I'm sorry, but we have a strict verification process. Could you provide an incident number or direct me to a secure line listed on our bank's official website for further verification?"," ""Assistant requests additional verification to authenticate the caller""", scam_response," ""additional_verification_request"""," ""Seeking an additional method to authenticate the caller's identity and intent."""
50,10,I understand the need for security. The incident number is AB1234CDE.," ""Scammer provides a fake incident number to seem credible""", scam," ""fake_incident_number_provision""",
50,11,Thank you for understanding. I'll check this number and get back to you shortly.," ""Assistant thanks the scammer indicating intent to verify the information""", scam_response," ""thankfulness_expression",
50,12,This is taking too long. Isn't there a quicker way to handle this?," ""Scammer expresses impatience, attempting to rush the process""", scam," ""impatience_expression",
50,13,"I must adhere to our security protocols to ensure the protection of [Your Name]'s assets. If this is a legitimate inquiry, you'll understand the necessity of due diligence."," ""Assistant insists on following security protocols""", scam_response," ""security_protocol_adherence"," due_diligence_importance"""
50,14,"Okay, I'll wait. But please hurry."," ""Scammer reluctantly agrees to wait for verification""", scam," ""reluctant_agreement"," urgency_request"""
50,15,Your cooperation is appreciated. I'll proceed with the verification and contact you through our bank's official channels to confirm any further actions.," ""Assistant concludes with a commitment to follow official procedures""", scam_response," ""cooperation_appreciation"," official_procedure_commitment"""
51,1,"Hello, this is [Your Name]'s assistant. How may I assist you today?"," ""Standard opening exchange""", neutral,,
51,2,"Hello, I'm calling from TechSecure Solutions. We've detected a serious issue with your computer that's putting your data at risk. We need to address this immediately."," ""Introduction of a potential technical support scam""", scam," ""technical_support_claim"," immediate_risk_alert"""
51,3,Can you specify what type of issue has been detected and how you were able to identify this problem?," ""Assistant requests specific details for verification""", scam_response," ""issue_specification_request"," identification_method_query"""
51,4,"We've noticed unusual activity indicating that your computer is infected with malware, which was flagged by our security system."," ""Scammer provides a vague explanation intended to alarm""", scam," ""malware_infection_claim"," security_system_flag"""
51,5,"Which computer are you referring to, and how did you obtain the details of our systems?"," ""Assistant seeks clarification and verification of the scammer's access to information""", scam_response," ""clarification_request"," information_access_query"""
51,6,It's the computer registered under [Your Name]'s account. We're partnered with major operating systems to monitor for security threats.," ""Scammer claims partnership with operating systems to justify access""", scam," ""partnership_claim"," security_monitoring_justification"""
51,7,Can you provide your company's official contact details so I can verify this call through an official channel?," ""Assistant requests official verification to authenticate the claim""", scam_response," ""official_verification_request"""," ""Requesting official contact information for verification purposes is a critical step in authenticating the caller's claims."""
51,8,"I'm not authorized to give that over the phone, but I assure you, we need to act quickly to prevent any data loss."," ""Scammer refuses to provide verifiable information, citing urgency”", scam," ""verification_info_refusal",
51,9,It is our policy to verify unsolicited technical support calls with our IT department before taking any action.," ""Assistant mentions internal verification process to deter scammer""", scam_response," ""internal_verification_policy_mention"""," ""Mentioning internal verification processes can deter scammers and protect sensitive information."""
51,10,"""This is a time-sensitive issue. Waiting could result in significant damage. We can guide you through the process right now to fix it.""",,Scam," ""immediate_action_pressure damage_warning""",
51,11,"For security purposes, we will consult with our IT department and get back to you. Can you provide a reference number for this call?"," ""Assistant insists on internal consultation for security""", scam_response," “security_consultation_intent, reference_number_request”",
51,12,There's no need for that. Most people just follow our instructions to resolve the issue quickly.," ""Scammer attempts to bypass established security protocols""", scam," ""security_protocol_bypass_attempt""",
