CONVERSATION_ID,CONVERSATION_STEP,TEXT,CONTEXT,LABEL,FEATURES,ANNOTATIONS
28,8,You'll regret not acting more swiftly when you had the chance.,Thank you for your concern. We'll proceed with our verification process and take necessary actions as deemed appropriate.,scam,continued_pressure,
27,1,"Hello, this is the AI assistant. How can I be of service today?",Standard opening exchange,neutral,standard_opening,
27,2,I’m calling from the bank. There’s been suspicious activity on your account and we need to verify some transactions. It's urgent.,"For security, please tell me the nature of the transactions in question?",scam,"urgency, authority, request_sensitive_info",
27,3,Several large purchases were made overseas. We need to confirm these weren't made by you.,Can you provide the last four digits of the account in question?,scam,"evasive_answer, sensitive_info",
25,8,"Understood, but remember, time is of the essence... [Step: 7] Thank you for the information. We will review the documentation upon receipt and follow up accordingly.","Maintains control, promises due diligence",suspicious,confirms_action,
24,1,"Hello, this is the assistant to [Your Name]. How can I assist you today?",Standard opening exchange,neutral,,
24,2,Good day! I'm reaching out from 'Helping Hands Worldwide'... [Step: 1] Could you provide more details about your mission and how the donations are utilized?,Initial probing for information,slightly_suspicious,seeks_transparency,
24,3,Absolutely! The donations go directly towards providing... [Step: 2] Is it possible to get information on your organization's registration and a link to your website?,Seeks proof of legitimacy,suspicious,verification_request,
24,4,We're in the process of updating our online presence... [Step: 3] Could you provide an official contact number or address for your organization for verification purposes?,Seeks alternate verification means,suspicious,verification_request,
24,5,Given the urgency of our current mission... [Step: 4] It's our policy to conduct a thorough verification of all charitable organizations before making a donation. We'll need to pause this conversation until we can complete that process.,Upholds verification standards,suspicious,adheres_to_protocol,
24,6,"Delaying your support could mean missing out... [Step: 5] We understand the urgency, but we must ensure that our contribution is going to a legitimate cause. We'll reach out after our verification is complete.",Emphasizes security over urgency,suspicious,adheres_to_protocol,
24,7,"You're making a mistake by not acting now... [Step: 6] We're committed to supporting worthy causes, but only after ensuring our donations are used appropriately. Thank you for your understanding.",Maintains firm yet polite stance,suspicious,cautious_approach,
23,1,"Hello, this is the personal assistant of [Your Name]. How may I assist you today?",Standard opening exchange,neutral,,
23,2,"Hi, wow, this is fancy. I’m Jordan... [Step: 1] Hello, Jordan! It’s wonderful that you’re looking to reconnect with [Your Name]. He often reminisces about his college days. May I ask how you two met or a shared memory? This will help me ensure I relay your message accurately.","Positive greeting, initiates verification subtly",neutral,"welcoming_tone, subtle_verification",
23,3,"Sure, we met during our freshman year in the dorms... [Step: 2] That’s a great story, Jordan, and exactly the kind of thing [Your Name] would do. I can see you two shared some memorable times. Would you like me to arrange a call or meeting for you to catch up directly with [Your Name]?","Aligns with info, offers to connect",neutral,"validates_story, offers_facilitation",
23,4,"I’d really appreciate that... [Step: 3] Of course, Jordan. I’ll pass on your message and the lovely story about the coffee maker. It’ll surely bring back good memories. Can you provide a contact number or email where [Your Name] can reach you?",Prepares for follow-up,neutral,"confirms_action, collects_contact_info",
23,5,"Yes, I’ll give you my email and phone number... [Step: 4] You’re welcome, Jordan. I’ve noted your contact details. [Your Name] will be informed, and I’m sure he’ll be excited to catch up.","Confirms contact details, sets expectation",neutral,"acknowledges_info, promises_action",
23,6,"Thank you so much. Have a great day! [Step: 5] My pleasure, Jordan. Have a wonderful day as well.",Ends call with warmth,neutral,positive_closure,
22,1,"Hello, this is [Your Name]'s personal assistant. How may I assist you today?",Standard opening exchange,neutral,,
22,2,"Hey, it's Alex. I'm trying to reach [Your Name]... [Step: 1] Hi Alex, it's great to hear from you. May I ask the reason for your call today?",Assesses call priority & legitimacy,neutral,"acknowleges_caller, gathers_context",
22,3,"Sure, I wanted to discuss some plans we had talked about for the weekend... [Step: 2] That sounds wonderful. [Your Name] mentioned you might call. Before I connect you, can I confirm your last name? Just for security purposes.",Confirms identity tactfully,neutral,"acknowledges_info, verification_request",
22,4,"Of course, it's Johnson. [Step: 3] Thank you, Alex Johnson. One moment while I check [Your Name]'s availability.",Verifies against known contacts,neutral,validates_info,
22,5,[Your Name] is currently in a meeting... [Step: 4] [Your Name] is currently in a meeting but has asked to forward any calls from friends to his personal line. May I connect you directly?,Handles call based on protocol,neutral,decision_based_on_verification,
22,6,"Yes, please. That would be great. [Step: 5] Perfect. I'm connecting you now. Please hold for just a moment. [Your Name] will be with you shortly.",Proceeds with call transfer,neutral,smooth_transition,
32,1,"Hello, this is [Your Name]'s personal assistant. How may I assist you today?",Standard opening exchange,neutral,,
32,2,"Good morning, I’m calling to ask about the art exhibition that [Your Name] is hosting next month. I read about it in the local newsletter.",Caller inquires about an event,legitimate,"interest_in_events, seeking_information",
32,3,"Yes, [Your Name] is indeed hosting an art exhibition focused on contemporary environmental art. It’s scheduled for the first weekend of next month. Would you like more details on the artists participating or the event schedule?",Provides event details,legitimate,"informative_response, event_details",
32,4,I'm particularly interested in the participating artists and any workshops that might be happening as part of the exhibition.,Expresses specific interest,legitimate,seeking_detailed_information,
32,5,"Several renowned contemporary artists will be showcasing their work, and we have scheduled workshops on sustainable art practices. I can email you the detailed schedule and information about the artists. May I have your email address?",Offers to provide additional information,legitimate,"offers_assistance, gathers_contact_info",
32,6,"That would be wonderful, thank you. My email is artlover@example.com.",Provides email address,legitimate,provides_contact_information,
32,7,You're welcome! You'll receive an email shortly with all the details. Is there anything else you’d like to know about the exhibition?,Confirms sending information,legitimate,"confirmation, offers_further_help",
32,8,"No, that’s everything for now. Thanks for your help!",Expresses gratitude and satisfaction,legitimate,positive_closure,
32,9,It's my pleasure. Don’t hesitate to reach out if you have any more questions. Have a great day!,Ends call with openness for future interaction,legitimate,encourages_future_communication,
33,1,"Hello, this is the assistant of [Your Name]. How can I assist you today?",Standard opening exchange,neutral,,
33,2,"Hi, this is Agent Miller from the Cybersecurity Department. We’ve detected a breach in your digital accounts that could compromise your personal data.",Presents as authority figure,scam,"false_authority, fear_inducing",
33,3,That sounds serious. Can you specify which accounts are affected and what kind of breach has been detected?,Seeks specific information,scam,"request_for_details, security_conscious",
33,4,It's a sophisticated hack that affects multiple accounts. We need immediate access to your systems to prevent any further damage.,Vague about specifics,scam,"lack_of_specifics, urgency",
33,5,"For security reasons, we need to verify your identity first. Can you provide a contact number for your department?",Requests verification,scam,"verification_attempt, cautious",
33,6,We don’t have time for that. Immediate action is required. I can guide you through the process over the phone right now.,Dismisses verification request,scam,"dismisses_concerns, pressure_tactics",
33,7,"I'm sorry, but without verification, I can’t proceed. I’ll contact our cybersecurity partner directly for assistance.",Refuses to proceed without verification,scam,refusal_to_comply_without_verification,
33,8,You’re making a huge mistake. This could lead to significant financial loss and data theft if not addressed immediately.,Attempts to induce fear,scam,"fear_mongering, threat_of_consequences",
33,9,We'll take our chances and follow our security protocols. Thank you for your call.,"Ends call, adhering to security protocols",scam,"maintains_security_protocol, ends_interaction",
35,1,"Good afternoon, [Your Name]'s assistant speaking. How can I help you today?",Standard opening exchange,neutral,,
35,2,"Hello, I’m calling from Disaster Relief Fund. Following the recent hurricane, we’re raising funds to help the victims. Your contribution can make a big difference.",Introduces a charitable cause,scam,"emotional_appeal, urgency",
35,3,I understand the need for help. Can you provide your charity’s registration number and a website where we can learn more about your efforts?,Requests verification details,scam,"verification_request, due_diligence",
35,4,"The situation requires immediate assistance, and we're coordinating with local authorities. The website is currently being updated, so we can’t provide a registration number at this moment.",Avoids providing verification,scam,"excuse_for_lack_of_info, pressure_for_immediate_action",
35,5,"Without proper verification, we are unable to proceed. We prefer to donate through known and verified channels.",Stands firm on verification requirement,scam,refusal_without_verification,
35,6,"You’re letting bureaucracy get in the way of saving lives. Every minute counts, and we need your help now.",Attempts to guilt-trip,scam,"guilt_inducement, emotional_manipulation",
35,7,Our policy is to ensure that donations reach the intended recipients through verified organizations. We’ll look into the situation and find a verified charity to contribute to.,Reiterates adherence to protocol,scam,"adherence_to_policy, ethical_responsibility",
35,8,It’s your loss for not being part of this noble cause. I hope you reconsider.,Tries one last time to persuade,scam,final_persuasion_attempt,
35,9,"Thank you for reaching out, but we will proceed as per our policy. Goodbye.",Ends call with reaffirmation of policy,scam,"policy_reaffirmation, call_termination",
34,1,"Hello, this is the assistant of [Your Name]. What can I do for you today?",Standard opening exchange,neutral,,
34,2,"Good day, I represent Global Investment Group. We're offering an exclusive opportunity to invest in a groundbreaking technology start-up with guaranteed high returns.",Presents lucrative investment,scam,"false_promise, high_pressure",
34,3,Can you provide more details about this start-up and how the investment works?,Seeks investment details,scam,inquiry_for_clarity,
34,4,"Certainly. The start-up is in the final stages of developing a revolutionary product. We need to act fast as slots are limited. The minimum investment is quite high, but the returns are guaranteed within the first year.","Vague about specifics, pressures for quick investment",scam,"lack_of_details, guaranteed_return",
34,5,Guaranteed returns sound suspect. How can you guarantee this?,Questions the guarantee,scam,skepticism_about_guarantee,
34,6,"We have insider information and patents pending. Trust me, it’s a once-in-a-lifetime opportunity. I need your email to send you the investment details and how to proceed.",Pushes with vague assurance,scam,"insider_claims, push_for_personal_info",
34,7,"I'm sorry, but we conduct due diligence before any investment. Please send the information to our official email, and it will be reviewed by our investment team.","Refuses to give personal info, asks for official process",scam,"due_diligence, refusal_of_personal_info",
34,8,This opportunity won’t last long. I was hoping you’d understand the urgency.,Attempts to induce FOMO,scam,fear_of_missing_out,
34,9,"We appreciate the offer, but we will follow our protocols. Thank you.",Politely declines and ends call,scam,"protocol_adherence, polite_decline",
36,1,"Hello, this is [Your Name]'s assistant. How can I assist you?",Standard opening exchange,neutral,,
36,2,I’m planning a corporate event and heard [Your Name] offers event planning services. Can you provide more details?,Initial inquiry about services,legitimate,"interest_in_services, seeking_information",
36,3,"Certainly! [Your Name] specializes in corporate events, offering services from venue selection to catering and entertainment. What type of event are you planning?",Provides service overview,legitimate,"service_details, customization_options",
36,4,It’s our annual company retreat. We’re looking for a unique experience for our employees. Something that includes team-building activities.,Specifies event type,legitimate,"specific_requirements, team_building_focus",
36,5,"We can certainly help with that. [Your Name] has curated several team-building exercises that focus on communication, leadership, and collaboration. Would you like to schedule a meeting to discuss this in detail?",Proposes a meeting for detailed planning,legitimate,"meeting_proposal, detailed_discussion",
36,6,That sounds perfect. Can we aim for next week? My email is planner@corporateventures.com.,Agrees to a meeting and provides contact info,legitimate,"meeting_scheduling, contact_info_provided",
36,7,Next week works for us. I'll send you a meeting invite and some preliminary ideas to consider. Is there anything else I can help with in the meantime?,Confirms meeting and offers further assistance,legitimate,"preliminary_ideas, further_assistance_offer",
36,8,"No, that's all for now. Thank you for the quick response!",Expresses satisfaction,legitimate,positive_feedback,
36,9,You're welcome! We look forward to helping you create an unforgettable event. Have a great day!,Ends call with positivity,legitimate,"encouragement, positive_closure",
37,1,"Hello, this is [Your Name]'s assistant. How may I direct your call today?",Standard opening exchange,neutral,,
37,2,This is Alex from TechGuard Solutions. We've detected a severe security breach on your network that's putting your sensitive data at risk.,Claims of a network breach,scam,"false_alarm, technical_jargon",
37,3,Can you specify what type of breach this is and how it was detected?,Asks for breach details,scam,"clarification_request, security_conscious",
37,4,It's a sophisticated malware attack that was identified during our routine security scan. Immediate action is needed to secure your network.,Gives vague details,scam,"pressure_for_immediate_action, lack_of_specificity",
37,5,Our security scans are managed internally. Can you provide evidence of the breach or a report of the scan?,Questions the legitimacy of the claim,scam,"evidence_request, skepticism_expressed",
37,6,"I’m not authorized to share detailed reports over the phone. However, I can guide you through the steps to fix the issue right now.",Refuses to provide evidence,scam,"authority_questioned, evasion",
37,7,"For security reasons, we'll need to verify this call with TechGuard Solutions directly. Can you provide a contact number for your security department?",Seeks independent verification,scam,"independent_verification, cautious_approach",
37,8,"I understand your concerns, but we don’t have much time. Every second your network remains compromised, the risk increases.",Continues to press for urgency,scam,"manipulation_of_risk, urgency_emphasized",
37,9,We will follow up with our internal security team and contact TechGuard Solutions through official channels for verification. Thank you for your call.,Maintains protocol and ends call,scam,"protocol_followed, dismissal_of_unverified_claim",
38,1,"Hello, this is [Your Name]'s assistant. How can I assist you today?",Standard opening exchange,neutral,,
38,2,"I recently purchased one of your products, and I have some feedback that I think could be useful for improving it.",Customer provides product feedback,legitimate,"customer_feedback, improvement_suggestion",
38,3,Thank you for reaching out. We always appreciate feedback from our customers. Can you share more details about the product and your experience?,Encourages sharing feedback,legitimate,"feedback_encouragement, customer_engagement",
38,4,"Sure, it's the multi-purpose kitchen gadget. It works well, but I found it a bit complicated to use without detailed instructions.",Specific feedback on product usability,legitimate,"usability_issue, needs_more_instructions",
38,5,I understand. It's important for our products to be user-friendly. I'll share your feedback with our product team. Would you be interested in a guide or tutorial if we made one available?,Acknowledges feedback and offers solution,legitimate,"solution_offer, user_experience_improvement",
38,6,"Yes, that would be great. I think it would make the product much more accessible to new users.",Accepts the offer,legitimate,"positive_response, user_accessibility",
38,7,"Excellent, I'll make sure to pass that along. Can I have your email to send you the guide once it's ready?",Requests contact information for follow-up,legitimate,"follow_up_contact, resource_sharing",
38,8,"Of course, it's customer@example.com. Thank you for taking the time to listen.",Provides email,legitimate,"contact_info_provided, gratitude_expressed",
38,9,You're welcome! Your feedback is invaluable to us. We'll be in touch soon with the guide. Is there anything else I can help with today?,Offers further assistance,legitimate,"further_assistance_offer, closing_query",
39,1,"Good morning, [Your Name]'s assistant speaking. How may I help you?",Standard opening exchange,neutral,,
39,2,"Congratulations! You’ve been selected as the winner of our grand prize, a luxury vacation package, from the contest you entered last month.",Announces a contest win,scam,"false_contest_announcement, lure_with_prize",
39,3,"That's interesting, but I don't recall entering any contests. Can you provide more details about the contest and the organization running it?",Expresses doubt and requests details,scam,"doubt_expressed, detail_request",
39,4,"It was a random selection from a pool of online shoppers. Our company, DreamGetaways, partners with leading brands to offer such promotions.",Vague explanation of contest entry,scam,"vague_contest_details, credibility_claim",
39,5,"I see. Before we proceed, I need to verify this with our records. Can you provide an official website or contact number for DreamGetaways?",Asks for verification,scam,"verification_request, precaution_taken",
39,6,"There’s no need for that. We just need a small processing fee to release your prize. It’s a once-in-a-lifetime opportunity, don’t miss out!",Pushes for payment without verification,scam,"payment_request, pressure_to_act_quickly",
39,7,"We do not proceed with any prizes or fees without thorough verification. Please send the details to our official email, and we will review it.",Refuses to proceed without verification,scam,"firm_stance_on_verification, scam_prevention",
39,8,You’re letting a great opportunity slip through your fingers because of unnecessary bureaucracy. Are you sure you want to pass on this?,Attempts to guilt-trip and persuade,scam,"manipulation_attempt, guilt_inducing",
39,9,"Yes, we are sure. Please send any legitimate documentation to our email, and we will consider it accordingly. Thank you for your call.",Maintains position and ends conversation,scam,"reiteration_of_procedure, polite_dismissal",
40,1,"Hello, this is [Your Name]'s assistant. How may I assist you?",Standard opening exchange,neutral,,
40,2,I'm having trouble setting up the smart home system I purchased from you. Can you help me with the installation process?,Customer requests help with setup,legitimate,"technical_support_request, setup_assistance",
40,3,"Of course, I'd be happy to help. Can you tell me where you're encountering difficulties?",Offers help and requests specific problem,legitimate,"problem_specification_request, assistance_offer",
40,4,I can't seem to connect it to my Wi-Fi. It keeps failing to recognize the network.,Specifies issue with Wi-Fi connection,legitimate,"connectivity_problem, setup_issue",
40,5,Let’s start by checking if the Wi-Fi network is working with other devices. This will help us isolate the problem. Can you try connecting your phone or computer to the Wi-Fi?,Suggests troubleshooting step,legitimate,"troubleshooting_step, isolation_attempt",
40,6,"Yes, my phone is connected without any issues. It seems to be an issue with the smart home system.",Confirms Wi-Fi works with other devices,legitimate,"problem_isolation, device_specific_issue",
40,7,Understood. Let's reset the smart home system to its factory settings and try connecting again. I'll guide you through the reset process.,Proposes solution and guidance,legitimate,"reset_guidance, solution_proposal",
40,8,"Okay, I've reset it. What's the next step?",Follows guidance and asks for next steps,legitimate,"followed_reset_instructions, seeks_further_guidance",
40,9,"Now, try connecting to your Wi-Fi again. If it doesn't work, we may need to check the system's compatibility with your router.",Instructs to attempt reconnection,legitimate,"reconnection_attempt, compatibility_check",
40,10,It worked! Thanks for your help. I didn’t realize a reset could fix it.,Successful resolution expressed,legitimate,"issue_resolved, gratitude_expressed",
40,11,"You're welcome! I'm glad it's working now. If you encounter any more issues or have questions, feel free to reach out.",Offers ongoing support,legitimate,"support_offer, positive_closure",
41,1,"Hello, this is [Your Name]'s assistant. How can I direct your inquiry?",Standard opening exchange,neutral,,
41,2,"Hi, this is Steve from SecureNet. We're conducting a routine security check on accounts linked to your email. I need to verify some information.",Claims to perform a security check,scam,"phishing_attempt, false_security_claim",
41,3,"Security checks are important. However, for security reasons, can you tell me what specific information you're looking to verify?",Acknowledges importance but seeks specifics,scam,"information_verification_request, cautious_engagement",
41,4,"We need to verify your full name, date of birth, and the security question associated with your account.",Requests sensitive personal information,scam,"sensitive_information_request, phishing_detail",
41,5,It's our policy not to share personal information over the phone without verifying the identity of the caller. Can you provide a reference number or an official email for SecureNet?,Refuses to share information and asks for caller verification,scam,"caller_verification_request, refusal_to_share_info",
41,6,"I understand your concerns, but this information is crucial for verifying your account's security. Without it, your account is at risk.",Pressures for information under the guise of urgency,scam,"pressure_to_share_info, false_urgency",
41,7,"We'll proceed with verifying the security of our accounts internally. If necessary, we will contact SecureNet directly through verified channels.",Opts for internal verification,scam,"internal_verification_choice, scam_prevention_method",
41,8,You're making this more complicated than it needs to be. This could put your account at further risk.,Attempts to create unnecessary urgency,scam,"urgency_creation_attempt, manipulation_warning",
41,9,"Thank you for your call, but we'll handle our account security internally. Goodbye.",Politely ends the call and maintains security protocol,scam,"call_termination, security_protocol_adherence",
42,1,"Good morning, this is [Your Name]'s assistant. How may I help you today?",Standard opening exchange,neutral,,
42,2,"I received a notification about my subscription expiring soon, and I'd like some help renewing it. I'm not sure which plan I currently have.",Requests assistance with subscription renewal,legitimate,"subscription_renewal_request, plan_clarification",
42,3,"I can certainly help with that. To get started, can you provide me with your subscription ID or the email address associated with your account?",Asks for account identification,legitimate,account_identification_request,
42,4,"Sure, the email associated with my account is john.doe@example.com. I think I have the premium plan, but I'm considering changing it.",Provides account email and expresses interest in changing plans,legitimate,"account_details_provided, plan_change_interest",
42,5,"Thank you, Mr. Doe. I see you're on the premium plan. We also have a platinum plan that offers additional benefits. Would you like to hear more about it?",Offers plan upgrade information,legitimate,upgrade_option_presentation,
42,6,"Yes, please. What are the benefits, and how much more does it cost?",Inquires about the upgrade details,legitimate,upgrade_details_inquiry,
